Timestamp,Win,Loss,Blocker,Win_sentiment,Loss_sentiment,Blocker_sentiment,Win_sentiment_category,Loss_sentiment_category,Blocker_sentiment_category,Week,Month
2025-07-09 14:34:49,"Completing my first week with Umuzi gave me confidence and a sense of purpose. I especially enjoyed the design thinking and Odyssey Plan exercises, which helped me plan and commit more effectively.","I didn’t get opportunities from two companies that interviewed me last month, which was discouraging. However, I learned from the experience and was grateful for the chance to engage with the associates managers.",Being financially unstable has been draining my energy and focus some days. But seeing my family support me through this keeps me going and reminds me to stay grateful.,0.5875,0.0,0.0,Positive,Neutral,Neutral,28,July
2025-07-09 14:43:15,"I enjoyed introspecting myself on the basis of building those prototypes and 5 lives, as much as they were not real they ignited me to think of my purpose and see how I can blend it with my formal education and skills to better myself and community as whole. Lastly, I have completed my diploma in Law and awaiting an acceptance into LLB degree. ","Except for being sick and experiencing challenges with reception, I have nothing negative. ","None, only temporary set backs (reception and etc) ",0.2166666666666666,-0.5071428571428571,0.0,Neutral,Negative,Neutral,28,July
2025-07-09 14:49:40,Submitting all my work in time and completing my Courses,I don’t have any,"Data , I couldn’t join some meetings because I was out of data ",0.0,0.0,0.0,Neutral,Neutral,Neutral,28,July
2025-07-09 14:50:41,I submitted most of the assigned assignments,I did not understand some assignments s well and it felt like a lot of work to have to attend classes the whole day and honour deadlines.I felt overwhelmed at some point also with catching up with the number of emails that we were recieving.,Spending most time in class leading to having little time to understand and execute the required work.Also experienced issues with my network when I joined meeting with my laptop which made it difficult to share my work in class.,0.5,0.4,0.153125,Positive,Positive,Neutral,28,July
2025-07-09 15:14:46,I enjoyed the Life Lifeline activity. I got to dig deep and ask myself difficult questions and be honest with myself.,,"I forgot to login to Google classroom, until I received an email from Natalie. ",0.15,0.0,0.0,Neutral,Neutral,Neutral,28,July
2025-07-09 16:02:20,I enjoyed and learnt from the design your life module. I was able to think deep on what I want career wise and had the opportunity to think much on how I can go about it. I even enjoyed the test kitchen exercise because it has brought me an insight on where I can start of from now on. And I also I can say I'm slowly gaining confidence in public speaking.,,I ran out of data which made me miss some sessions,0.2624999999999999,0.0,0.0,Neutral,Neutral,Neutral,28,July
2025-07-09 16:19:53,"What went well was hearing other candidates plan for their 10 years Odyssey,  I enjoyed it because it was inspiring a lot.",I would say I struggled a bit or was confused when we were doing the one with the symbol. I was supposed to use Google slide instead of pdf document.,I would say not reading instructions sometimes was a blocker because I had to go back and fix mistakes.,0.2916666666666667,-0.4,0.0,Neutral,Negative,Neutral,28,July
2025-07-09 19:50:47,I enjoyed sharing my symbol and it's meaning.,I submitted 2 of my tasks late last week.,"There is a power failure affecting a few houses in my neighbourhood. Unfortunately, this has been ongoing for the past two weeks and is only expected to be resolved next week. I'm really sad to be missing the online sessions during this time, but I’m doing my best to stay updated and catch up where I can. ",0.5,-0.15,-0.1066666666666666,Positive,Negative,Negative,28,July
2025-07-09 21:48:18,"It was a good week, I learnt a lot about myself, the DYL segment was very eye-opening for me, I really enjoyed the activities we did.",,"Nothing hectic, just network issues. ",0.4666666666666666,0.0,0.0,Positive,Neutral,Neutral,28,July
2025-07-10 00:42:57,"Although I couldn't submit on time, the tasks were really enjoyable and taught me lots of new things such as the odyssey plan which I was hearing about for the first time",I was not able to submit last week work on time,I didn't have much time on my hands since I was blessed with a baby recently but mom was able to come help and now I am able to participate,0.2215909090909091,-0.125,0.3,Neutral,Negative,Positive,28,July
2025-07-10 00:49:48,I learnt direction with my life path and that it is okay to not have everything figured out.,"Connectivity and data challenges, along with equipment.",data,0.5,0.0,0.0,Positive,Neutral,Neutral,28,July
2025-07-10 08:58:41,I’ve been experimenting with prompts and really seeing how powerful and useful AI can be when applied right. I’m excited to keep building on that and learning how to integrate it more practically into my workflow.,It was challenging to let go of my old way of writing prompts which was being generic but I am learning how to be more specific when prompting LLMs.,I had nothing I would classify as a blocker.,0.3267857142857143,0.22,0.0,Positive,Neutral,Neutral,28,July
2025-07-10 09:30:28,"The communication from Umuzi team is very thorough and effective, this make it easy on the learners' side.",none,illness,0.4111111111111111,0.0,0.0,Positive,Neutral,Neutral,28,July
2025-07-10 09:36:24,Managed to complete all my work in time.,,"Unable to complete the Odyssey Children's Book assignment as I do not have access to 'Odyssey Children's Book Template' link, I have requested access but nothing has changed.",0.1,0.0,-0.2,Neutral,Neutral,Negative,28,July
2025-07-10 10:13:12,a win from last week is getting to know my classmates well,,"my laptop mic was not working,so it interrupted me on many presentations but i managed to resolve my problems later on",0.4,0.0,0.25,Positive,Neutral,Neutral,28,July
2025-07-10 10:25:14,I managed to do my passport,Travelling to work on Monday,,0.0,0.0,0.0,Neutral,Neutral,Neutral,28,July
2025-07-10 10:33:39,Prototype budget,"I do not know, maybe presenting something.","Nothing much, maybe doing house chores.",0.0,0.0,0.2,Neutral,Neutral,Neutral,28,July
2025-07-10 10:52:29,"Completed the desktop UI for my chat app (React + Tailwind), and finally gained clarity on task breakdown and workflow — everything started clicking into place","Had to walk away from my previous job — a hard but necessary step for growth. On a personal note, my headset broke again after repairing it, which was frustrating. Both events reminded me to let go of what’s no longer serving me, even when it hurts.","Switched to Vodacom Home Prepaid, which is significantly slower than Telkom in my area. I’m locked in for the month, so I'm adapting by scheduling downloads during off-peak hours. It’s slowing some tasks but manageable with patience",0.0,-0.1716666666666667,0.375,Neutral,Negative,Positive,28,July
2025-07-10 10:58:24,Experience labs sessions (provided me with a new perspective in career planning),,Fatigue (needed to create an Apex project),0.1363636363636363,0.0,0.0,Neutral,Neutral,Neutral,28,July
2025-07-10 12:41:19,I managed to work according to a schedule. The schedule has really been helping work more efficiently this week.,Keeping up with the different assignments/activities on the various platforms was overwhelming at first but I have gotten used to it.,I have been experiencing some technical difficulties.,0.35,0.1875,0.0,Positive,Neutral,Neutral,28,July
2025-07-10 14:21:27,I enjoyed the Design Your life week. It helped me be more insighful about my life.,What challenged me last week was basically my time management. I got a wake up call that doing other stuff outside the Umuzi work requires good time management so I could balance all my responsibilities.,I'm not sure of any blockers right now.,0.5,0.14375,0.0178571428571428,Positive,Neutral,Neutral,28,July
2025-07-10 14:29:38,"I made significant improvements on my first chatbot last week, it's still not very smooth but it works better now","A recent challenge I faced was trying to balance multiple priorities,  particularly starting my freelance journey while still navigating uncertainties around my financial situation. I'm still figuring things out","A blocker I experienced recently was emotional burnout. I’ve been juggling a lot mentally, and while I try to stay focused and productive, some days it’s hard to stay present or motivated. I’ve been pushing through by staying busy with hands-on work like my freelance projects and the tasks given by Umuzi",0.1942307692307692,0.0,0.0726190476190476,Neutral,Neutral,Neutral,28,July
2025-07-10 14:37:29,keeping up with my latest assignments,,,0.5,0.0,0.0,Positive,Neutral,Neutral,28,July
2025-07-10 18:04:56,"The Odyssey plan really hit home with me, I needed to that activity","Temporarily moving to Johannesburg, has left me a bit off in completing my work properly ",The aforementioned,0.2,0.0,0.0,Neutral,Neutral,Neutral,28,July
2025-07-10 20:23:06,"Last i had more time to dig a lil bit of myself, which was challenging at first but it made realize that i do not spend most time with myself and planning my future not in my head but writing it down.",I had a difficult time balancing my work and attending the kids.,My blocker was bad network and data,0.2277777777777777,-0.5,-0.6999999999999998,Neutral,Negative,Negative,28,July
2025-07-10 20:25:48,"Designing your life sessions went very well, I enjoyed how these lessons have helped me unpack things that I didnt realize about myself. ","Opening up was very challenging, am an introvet and I don't really like to talk but I realized that there are some student who are like me and they opened up.","Other commitment like school, sometime the live sessions we have clashes with school webiners.",0.35,0.425,0.0056818181818181,Positive,Positive,Neutral,28,July
2025-07-10 20:41:41,Completed my Google cyber security certification.,Lost access to my old Google account,Lack of data,0.0,0.1,0.0,Neutral,Neutral,Neutral,28,July
2025-07-10 22:30:48,I have enjoyed that I was able to pay my rent,"I thought this month things are going to be better, get a permanent job ",Requirements,0.5,0.5,0.0,Positive,Positive,Neutral,28,July
2025-07-10 23:49:07,"Before this program started, I was beginning to become frustrated with myself and my life. I felt like I was taking any job to survive. I didn't expect that one of my tasks was the one thing I've been thinking about, but struggling to start. I was happy that I was challenged to sit and think about my future. To create a realistic plan, even though it may not go according but i have milestones put in place for me to work towards. No pressure towards me, but grateful that it's done, and I can now remember things that I want to achieve, and even improve the plan. ","One of the challenges that I faced was that I was told about this program last minute, so preparation on my end was not properly done at the start of the week. And trying my best to show up for every session and make time to do my tasks.","A blocker that I experienced was that my baby was sick last week, due to this, I missed a submission. ",0.0666666666666666,0.3333333333333333,-0.0098214285714285,Neutral,Positive,Neutral,28,July
2025-07-11 08:17:15,Managing to submit tasks even though it was a bit difficult for me as I was not used to the set up.,At the beginning it was hard for me to adapt to working online,Had an issue with electricity which made it a bit difficult for me to attend but it is solved now.,-0.5,-0.2916666666666667,-0.5,Negative,Negative,Negative,28,July
2025-07-11 17:46:38,I learnt a lot from the DYL series about how to plan my live which is something I had never done before.,There are a few assignments I turned in late.,Having to go to work at night and attend classes and meetings during the day.,0.1363636363636363,-0.25,0.0,Neutral,Negative,Neutral,28,July
2025-07-13 16:15:43,I was equipped with both tech (AI) and financial literacy,,,0.0,0.0,0.0,Neutral,Neutral,Neutral,28,July
2025-07-14 00:03:14,"I enjoyed the Design Your Life Odyssey plans because it was a fun and creative way to think about my life choices and plans, doing small things or experiments to get there and pivoting when necessary.",Time Management - working on improving that.,Time Management - working on improving that.,0.21,0.0,0.0,Neutral,Neutral,Neutral,29,July
2025-07-14 18:06:28,Caught up with a old friend and we had great catch up,Dedicating time to focus on my honours project,I caught flue and it's  really been rough and draining,0.45,0.0,0.05,Positive,Neutral,Neutral,29,July
2025-07-15 15:34:34,Learning about AI and also rewatching the worth me video.,I would say finishing the datacomb assigned tasks,,0.3,0.0,0.0,Positive,Neutral,Neutral,29,July
2025-07-15 18:16:19,I have set myself a weekly goal and I have achieved it,"I have not yet been able to start with my Launch courses, but I will start today ",I currently do not have any blocker,0.0,0.5,0.0,Neutral,Positive,Neutral,29,July
2025-07-15 19:46:55,"Learned how to use AI, able to think deeper about the things I can achieve.","I'm still trying to get used to working online on my own, but it's getting better.",Not being able to access the Financial course,0.5,0.55,0.25,Positive,Positive,Neutral,29,July
2025-07-15 21:46:20,Completed all my assigned tasks well,,,0.0,0.0,0.0,Neutral,Neutral,Neutral,29,July
2025-07-16 07:35:15,I beat flu that almost took me out,I didnt go to gym for the whole week,Flu,0.0,0.2,0.0,Neutral,Neutral,Neutral,29,July
2025-07-16 08:32:40,I have begun taking control of my financial life by working on a budget.,"Everything went pretty smoothly this week, besides the ""Financial Foundations"" course not being available.","The ""Financial Foundations"" course  was not available on my ""Worth"" portal",0.0,0.2625,0.0333333333333333,Neutral,Neutral,Neutral,29,July
2025-07-16 08:38:58,"I managed to finish my work for my side project and meet the deadline in time, leant a lot new skills and knowledge about managing money.",,"When working in a team from my side gig, I had to wait for another team member to complete his work in order for me to start mine.",0.1363636363636363,0.0,0.1,Neutral,Neutral,Neutral,29,July
2025-07-16 08:50:23,"I learned more about AI, that was interesting for me.",Everything was fine for me.,"Not having data, made me start doing my work late. I started doing my work after the due dates, and i was confused i did not know where to start.",0.5,0.4166666666666667,-0.2749999999999999,Positive,Positive,Negative,29,July
2025-07-16 08:55:14,"I learned more about AI, It was interesting for me. ","I started doing doing my work late due to lack of data, and it was confusing because i was left behind. I didn't know where to start.",Lack of Data,0.5,-0.225,0.0,Positive,Negative,Neutral,29,July
2025-07-16 09:57:46,Managed to complete and submit all the activities that were due on time.,"On a personal point of view, a challenge was that my nanny is on leave and I am left alone with the kids at home because of school holidays.Otherwise I am progressing even though looking after the kids causes challenges for me attend classes.","There was no blocker,I did everything that I had to do.",-0.0124999999999999,0.0,0.0,Neutral,Neutral,Neutral,29,July
2025-07-16 12:01:33,My knowledge concerning financial planning has drastically increased,My time management this week has been seeing a bit of a slowdown,none for now,0.0,0.0,0.0,Neutral,Neutral,Neutral,29,July
2025-07-16 12:55:39,learning,,,0.0,0.0,0.0,Neutral,Neutral,Neutral,29,July
2025-07-16 13:01:03,learning new skill,,,0.1363636363636363,0.0,0.0,Neutral,Neutral,Neutral,29,July
2025-07-16 14:15:59,"I really enjoyed learning about managing personal finances, I think it is something everyone should learn",,unable to access the 'Financial Foundations' course on Worth.,0.25,0.0,-0.0666666666666666,Neutral,Neutral,Neutral,29,July
2025-07-16 14:33:19,"I really enjoyed the Worth Wealthy Me course this past week. It helped me realize that building wealth is achievable when you have a plan for your money, how to use it, save it, invest it, and stay out of debt. Even if you're already in debt, the course taught me practical ways to manage it. What made me feel amazing is that, despite past mistakes with my finances, I now have the knowledge and skills to manage my money better and build a stronger financial future.","During the Worthy Wealthy Me course, I felt a bit down as I reflected on the financial mistakes I’ve made in the past. It was challenging to confront those decisions, but the course also gave me hope. It reminded me that it’s never too late to take control, there’s still time, and that time is now. I’ve realized that becoming wealthy and financially independent is truly possible.","There were no blockers this week, nothing stopped me from doing what I needed to do.",0.2111111111111111,0.1434343434343434,0.0,Neutral,Neutral,Neutral,29,July
2025-07-16 15:01:12,The Experience Lab is going well and I have been accepted to study LLB with University of South Africa as of August 2025.,,,0.0,0.0,0.0,Neutral,Neutral,Neutral,29,July
2025-07-16 15:23:42,Gained amazing knowledge to the concept of finance,none for now,none for now,0.6000000000000001,0.0,0.0,Positive,Neutral,Neutral,29,July
2025-07-16 15:24:36,Leant a lot about money,,,0.0,0.0,0.0,Neutral,Neutral,Neutral,29,July
2025-07-16 15:25:05,,,,0.0,0.0,0.0,Neutral,Neutral,Neutral,29,July
2025-07-16 15:25:56,I got my Data Scientist Associates Certification on DataCamp.,I first failed the first practical exam but got great results on my second try.,"Power outages, my laptop has a problem of turning off when disconnected to a power source ",0.0,0.16,0.0,Neutral,Neutral,Neutral,29,July
2025-07-16 15:29:49,"I have begun taking control of my financial situation, thanks to The Wealthy Me course. I am confidently planning my budget with the knowledge I received this week.","I was not able to access the ""Financial Foundations"" course.","I was not able to access the ""Financial Foundations"" course.",0.3,-0.125,-0.125,Positive,Negative,Negative,29,July
2025-07-16 15:32:50,"I enjoyed the Worth course so far. Taught me a lot about how to manage my finances. I also enjoyed the DataCamp courses where I learnt a lot more about AI, how to train it and also what is involved in AI Ethics. ",All wins this week fortunately.,Initially I wasn't able to access the Financial Foundations course however that has been resolved and I have been able to do it.,0.38,0.35,0.25,Positive,Positive,Neutral,29,July
2025-07-16 15:35:09,,,,0.0,0.0,0.0,Neutral,Neutral,Neutral,29,July
2025-07-16 15:40:48,"I enjoyed creating the children's book using generative AI, it looked like a real book. it was fun creating it",Could not finish some of my assignments,"Had technical issues, my phone that i use to hotspot my PC got broken",0.3333333333333333,0.0,-0.2,Positive,Neutral,Negative,29,July
2025-07-16 15:47:11,I enjoyed learning about how to live frugally on the wealthy me course.,,,0.3787878787878787,0.0,0.0,Positive,Neutral,Neutral,29,July
2025-07-16 15:54:56,"Learning about money matters, debt management and investing ",,,0.0,0.0,0.0,Neutral,Neutral,Neutral,29,July
2025-07-16 16:02:16,I REALLY enjoyed this weeks learning experience. It made less scared of money,There's wasn't a loss this week,N/a,0.1666666666666666,0.0,0.0,Neutral,Neutral,Neutral,29,July
2025-07-16 16:04:14,"I really enjoyed this weeks learning experience,  it made less intimidated on money, building wealth etc.",N/a,N/a,0.1666666666666666,0.0,0.0,Neutral,Neutral,Neutral,29,July
2025-07-16 16:39:01,I was able to complete my tasks on time,My week went well I believe,,0.3,0.0,0.0,Positive,Neutral,Neutral,29,July
2025-07-16 16:39:15,I completed all my assigned tasks and assignments on time,,,0.0,0.0,0.0,Neutral,Neutral,Neutral,29,July
2025-07-16 17:59:55,"I enjoyed the doing the children odyssey book, I really enjoyed using AI.",Nothing really happened that was challenging,Nothing much,0.5,0.35,0.2,Positive,Positive,Neutral,29,July
2025-07-16 21:11:31,These teachings of how to save and invest money are great.,I am struggling to invest and save money even after the teachings,"I am a greedy person, i think.",0.8,0.0,0.0,Positive,Neutral,Neutral,29,July
2025-07-16 21:45:48,"A win for me last week, was me being to submit my tasks in time.",I'm hoping to meet my classmates soon,I still do not have electricity,0.4,0.0,0.0,Positive,Neutral,Neutral,29,July
2025-07-16 22:55:01,"I gained a deeper understanding of AI, including its fundamentals and advanced models. I also explored key ethical considerations, challenges, and policies, as well as the processes involved in generating and collecting information from datasets used by AI tools.",N/a,N/a,0.2,0.0,0.0,Neutral,Neutral,Neutral,29,July
2025-07-21 08:08:40,"I enjoy completing my certificates of worth me, they were very educational.",Not being able to access the financial foundation course.,,0.3416666666666666,0.25,0.0,Positive,Neutral,Neutral,30,July
2025-07-22 13:33:33,The preparation of our home ancestral ceremony,"I couldn't do my work, I am far behind with my submissions","The preparation of the ceremony demanded a lot from me, physically and mentally I was exhausted",0.0,-0.15,-0.1666666666666666,Neutral,Negative,Negative,30,July
2025-07-22 14:25:35,I enjoyed learning about finances. Making wiser financial decisions.,The challenge I had was solved,Had bad network sometimes but it got better,0.25,0.0,-0.0999999999999999,Neutral,Neutral,Neutral,30,July
2025-07-23 16:44:36,"I managed to finish my tasks on time,","Family demanding, I had to plan and schedule family and school work accordingly.",,0.0,0.0,0.0,Neutral,Neutral,Neutral,30,July
2025-07-24 12:07:49,Completed FNB app of the year exam,Travelling expenses,,0.0,0.0,0.0,Neutral,Neutral,Neutral,30,July
2025-07-24 22:18:30,,,,0.0,0.0,0.0,Neutral,Neutral,Neutral,30,July
2025-07-28 23:19:35,I got to get into a team of deep thinkers,email wasnt working so couldnt do my work.,email not working,0.0,0.0,0.0,Neutral,Neutral,Neutral,31,July
2025-08-01 15:23:33,Coming up with an innovation idea as a team.,Sleeping very late.,,0.0,-0.39,0.0,Neutral,Negative,Neutral,31,August
2025-08-01 15:32:59,Learning new things which are productive to my career,Sometimes missing out the class,,0.1363636363636363,-0.2,0.0,Neutral,Negative,Neutral,31,August
2025-08-04 14:41:26,Doing the wire frame for figma with the group.,A lot of restless nights,,0.0,0.0,0.0,Neutral,Neutral,Neutral,32,August
2025-08-06 09:59:52,I learned alot about design thinking,consumed a lot of mobile data,,0.0,0.0,0.0,Neutral,Neutral,Neutral,32,August
2025-08-06 10:03:06,I manage to attend the in person interview even I were bit nervous about it although I'm glad I did very well.,"Multiple task, I couldn't assist my team for the last 2 days on MUB due to preparation of an interview such as travelling and bookings.",Traveling,0.35,-0.03125,0.0,Positive,Neutral,Neutral,32,August
2025-08-06 10:14:13,We successfully presented our solutions last week.,,,0.375,0.0,0.0,Positive,Neutral,Neutral,32,August
2025-08-06 10:15:09,Presentation skills,,,0.0,0.0,0.0,Neutral,Neutral,Neutral,32,August
2025-08-06 10:30:56,Making progress on my honours research project,Taxi rank chronicles  and not being able to commute on time due to traffic and taxi strike in my area,Taxi strike in my area,0.0,-0.1416666666666667,0.0,Neutral,Negative,Neutral,32,August
2025-08-06 10:31:39,My team and I managed to successfully design and present a mockup presentation for our idea.,Our communication as a team was a bit lacking at first but gradually improved as the week went on.,The time given to complete the MUB sprint was short and therefore felt a bit rushed.,0.375,0.25,0.05,Positive,Neutral,Neutral,32,August
2025-08-06 11:24:08,I enjoyed seeing other presentations.,,,0.1875,0.0,0.0,Neutral,Neutral,Neutral,32,August
2025-08-06 11:51:17,our unique presentation,,,0.375,0.0,0.0,Positive,Neutral,Neutral,32,August
2025-08-06 13:02:04,"The MUB course was fun, we got to work as teams and I learned a lot.",,,0.3,0.0,0.0,Positive,Neutral,Neutral,32,August
2025-08-06 15:40:56,My team's presentation,We couldn't present our prototype due to time,connectivity and time,0.0,-0.0625,0.0,Neutral,Neutral,Neutral,32,August
2025-08-07 08:55:41,working in a team,Time management of personal work,none,0.0,0.0,0.0,Neutral,Neutral,Neutral,32,August
2025-08-07 09:42:02,Had a reunion with my friends after a long time,My interview got cancelled because they decided to freeze the post,Nothing,-0.05,0.0,0.0,Neutral,Neutral,Neutral,32,August
2025-08-07 10:49:23,I enjoyed working with a team and successfully finishing everything on time as we planned,,,0.625,0.0,0.0,Positive,Neutral,Neutral,32,August
2025-08-08 12:59:56,,,,0.0,0.0,0.0,Neutral,Neutral,Neutral,32,August
2025-08-20 12:05:32,I really enjoyed doing the 10 year odyssey plan.,My Test Kitchen wasn't done correctly.,None whatsoever.,0.5,0.0,0.0,Positive,Neutral,Neutral,34,August
2025-08-20 17:44:06,"I enjoyed opening to people about how I feel, and listening to their stories.",I could not understand the Odyssey plan clearly,I had to skip classes for 2 days which led to me missing some activities,0.5,0.1,-0.2,Positive,Neutral,Negative,34,August
2025-08-20 17:53:10,"I enjoyed sharing about my life, while listening to other share their journey",I couldn't understand the odyssey plan well.,I had to skip classes for 2 days which led to missed activities.,0.1875,0.0,0.0,Neutral,Neutral,Neutral,34,August
2025-08-20 18:49:03,I enjoyed doing all activities because it made me reflect on my future career plan,I had poor network coverage,Network Coverage,0.25,-0.4,0.0,Neutral,Negative,Neutral,34,August
