Timestamp,Win,Loss,Blocker,Win_sentiment,Loss_sentiment,Blocker_sentiment,Win_sentiment_category,Loss_sentiment_category,Blocker_sentiment_category,Week,Month
2025-10-03 22:44:33,I really enjoyed designing my life. It gave me a sense of direction. Also learning more about my peers and where they are in life gave me reassurance that I shouldn't be rushing. I can take life as it comes while enjoying all the small wins.,"I tried doing the Odessey plan the way I thought I could understand better but it was not the case with Dr. Zulfah. The reason I used pictures that I only could understand was because I plan to print it out and use it as a reminder but i dont want people knowing my plans. To them it will be pictures, to me it's a plan.",There were no blockers. I am really enjoying my time here and Yincee is the icing on the cake.,0.31,0.25,0.5,Positive,Neutral,Positive,40,October
2025-10-04 00:21:14,I enjoyed doing the oddysey plan even though I failed it.,Class attendance,There isn't enough hours in a day.,0.0,0.0,0.0,Neutral,Neutral,Neutral,40,October
2025-10-04 08:41:29,"From last week tasks I got 10/10 all of them, that's give me motivation to push more and be committed to meet strictly deadlines",After all my effort watching videos and completing every exercise after each video then got completion of certificate but I wasn't able to submit my certificate yesterday,Data,0.25,0.5,0.0,Neutral,Positive,Neutral,40,October
2025-10-04 08:54:36,"Last week tasks I got 10/10 Grade score, that's motivated me to push more and ensure I meet strictly deadlines, also excel more to my tasks ",After all my effort watching videos and doing each exercises each  after video then got completion of certificate but I wasn't able to submit my certificates yesterday on classroom,My issue is Data,0.3333333333333333,0.5,0.0,Positive,Positive,Neutral,40,October
2025-10-04 09:18:13,"One win from last week: I spent time using ‘Design Your Life’, and it was a game-changer. It reminded me that not everything is black and white, helped me reframe challenges into opportunities, and unlocked new solutions I hadn’t seen before. It’s empowering to move away from being stuck on problems and start thinking creatively about success.",No significant losses this week—I’m impressed with how things are going.,None this week; everything went smoothly.,0.1837121212121212,0.40625,0.4,Neutral,Positive,Positive,40,October
2025-10-04 13:34:06,"I enjoyed making the odyssey plan ,prototype budget and test kitchen .I am halfway through practicing for my learner`s license.",I had a lot of internet connection problems which prevented me to participate when I really wanted to .,"Well I feel like if there`s anything that would be  preventing me from doing anything ,it would be me but so far nothing .",0.5,0.2,0.1,Positive,Neutral,Neutral,40,October
2025-10-04 13:45:22,I completed a data science project I have been working on for 2 weeks.,"For almost the rest of last week, I was experiencing bad reception, so I couldn't really participate in the sessions. However, I have since upgraded my router and everything has been fine.",Bad reception (network issues),0.0,-0.0208333333333332,-0.6999999999999998,Neutral,Neutral,Negative,40,October
2025-10-04 17:45:04,I completed most of my work so far.,I feel my work could be off higher quality and I wasn't too time conscious.,Procrastination,0.3,0.175,0.0,Positive,Neutral,Neutral,40,October
2025-10-04 21:57:27,"creating a budget, and the kitchen recipe activity.",What challenged me was the odessy plan. i didn't have an idea how to start since i never really plan ahead to that point.,Thus far I managed to complete all my assigned work.,0.0,-0.1,0.1,Neutral,Neutral,Neutral,40,October
2025-10-04 23:04:49,"I achieved high marks on all my assignments which made me feel very motivated me. However beyond academics, I have made new friends and felt incredibly welcoming and supportive.",I couldn’t attend some Google meetings this week.,I couldn’t attend some Google meetings this week.,0.3792727272727273,0.0,0.0,Positive,Neutral,Neutral,40,October
2025-10-05 01:00:23,I enjoyed the Kitchen test activity.,"I did not understand how to do my Odyssey plan, and I did not execute it to the best of my ability.
","My blocker is my unstable connection, which leads me to submit my work later.",0.5,1.0,0.0,Positive,Positive,Neutral,40,October
2025-10-05 03:30:07,"Making the Odyssey Plans and the 5 lives, it got me really thinking about the life I want to have.",Nothing so far.,Nothing so far.,0.2,0.1,0.1,Neutral,Neutral,Neutral,40,October
2025-10-05 04:30:45,"I enjoyed making my odyssey plan ,prototype and most importantly my test kitchen .I found some kind of direction for my life and I am even 75% through my learners license practice which is something I highlighted that I will do in my test kitchen.",I didn`t have good internet connection and that prevented me from participating when I really wanted to in meetings,"If there is anything that would stop me from doing what I need to do ,that thing would be me but so far there`s nothing .",0.5,0.4499999999999999,0.1,Positive,Positive,Neutral,40,October
2025-10-05 07:15:56,"A win for me this week was taking time to reflect on my goals and map out small, realistic steps I can take towards them. It felt good to apply the Design Your Life approach and see how small adjustments in my daily routine can align with the bigger picture of where I want to be.",A challenge for me this week was sticking to the plans I designed for my routine. I noticed I got a bit overwhelmed and didn’t manage my time as well as I hoped. It showed me that I still need to refine how I design my days to make them more realistic.,A blocker for me was struggling to priorities tasks I sometimes spent too much time on one thing and it stopped me from completing others. I’m realizing I need to adjust how I plan my time blocks.,0.1666666666666666,0.3333333333333333,0.05,Neutral,Positive,Neutral,40,October
2025-10-05 07:32:05,I got 10/10 to all my assignments and I got an email from Datacamp which congratulate me for earning 7850 XP on first week of Datacamp learning. That's motivated me to keep pushing more.,After all my effort watching videos and doing each exercises for each Datacamp but on 03 October I wasn't able to submit my certificate via classroom classwork,Data,0.375,0.5,0.0,Positive,Positive,Neutral,40,October
2025-10-05 08:10:49,I enjoyed having to know myself more and understanding why I wanted to pursue most of my visions,Difficulty in finding balance for both Umuzi and academics,Network problems,0.5,0.0,0.0,Positive,Neutral,Neutral,40,October
2025-10-05 08:20:44,I passed most of my assignments.,I failed one assignment,"Financial constraints, I didn't have enough data to join the sessions.",0.5,-0.5,0.0,Positive,Negative,Neutral,40,October
2025-10-05 08:39:41,I have Finally managed to get a good internet connection.,I missed my assignments due to loadshedding,Loadshedding,0.35,-0.125,0.0,Positive,Negative,Neutral,40,October
2025-10-05 11:29:12,I managed to improve my marks after having a bad start.,The first activity that we were given puzzled me but I managed to finish even though my marks are not pleasing.,There was nothing that stopped me from completing tasks but mismanagement of time nearly made it hard but i was able to plan my time,-0.6999999999999998,0.25,0.1027777777777777,Negative,Neutral,Neutral,40,October
2025-10-05 13:39:22,I Managed to complete my assignments for the week,I struggled with my WIFI connection on Thursday and was not able to actively participate in the online activities.,I had Wi-Fi connection issues.,0.1,-0.1916666666666666,0.0,Neutral,Negative,Neutral,40,October
2025-10-05 15:21:38,"Managed to submit everything on time, and learned about AI","some of my marks are a bit low, I will need to improve.",,0.0,0.0,0.0,Neutral,Neutral,Neutral,40,October
2025-10-05 16:19:26,Creating my Odyssey Plan for the first time in my life.,Failing to submit my symbol.,Writing and preparing for my tests.,0.25,0.0,0.0,Neutral,Neutral,Neutral,40,October
2025-10-05 16:36:35,"I completed all my work and submitted everything on time. I felt very productive, organised and proud of my self.","My main challenge last week was staying focused when things got repetitive. I got everything done, but it took extra effort to stay motivated through the routine tasks.",My main blocker was balancing all my work I had to do. It slowed me down but I got everything done.,0.5,-0.0208333333333333,0.0055555555555555,Positive,Neutral,Neutral,40,October
2025-10-05 17:04:51,I finished all of my assessments on time,I could not attend some of my classes,I was sick,0.0,0.0,-0.7142857142857143,Neutral,Neutral,Negative,40,October
2025-10-05 18:51:16,I completed a data science project I have been working on for the past 3 weeks.,"Poor reception was a hindrance last week. I could not attend and participate in some of the sessions. It was really challenging. However, I got to upgrade my router.",Poor reception (Network issues),-0.25,0.0333333333333333,-0.4,Negative,Neutral,Negative,40,October
2025-10-05 19:21:58,"I enjoyed creating my oddesy plan, it made me realize just how much work i have to put in to garantee success",Nothing,There was no blocker,0.3333333333333333,0.0,0.0,Positive,Neutral,Neutral,40,October
2025-10-05 19:23:29,Engagement and commitment,Time mama,I have two classes in a same time,0.0,0.0,0.0,Neutral,Neutral,Neutral,40,October
2025-10-05 19:38:41,I enjoyed doing the 5 Lives activity because it helped me think about different paths for my future.,"I found it hard to choose which ideas to focus on in my Odyssey plans, and turning some of my ideas into clear prototypes was a bit challenging.",,0.1666666666666666,0.1027777777777777,0.0,Neutral,Neutral,Neutral,40,October
2025-10-05 19:38:44,Last week I managed to stay consistent with my studies despite feeling overwhelmed. I’m proud that I didn’t give up and kept pushing through.,"I struggled with balancing my workload. It felt like there was too much to do at once, and I couldn’t give my best to everything.",My biggest blocker right now is financial stress — not having enough money adds pressure and sometimes makes it harder to focus fully on my studies.,0.35,0.6,0.0464285714285714,Positive,Positive,Neutral,40,October
2025-10-05 19:46:47,Going to the doctor's after procrastinating so long,,Getting flu and being sick for over a week,-0.05,0.0,-0.7142857142857143,Neutral,Neutral,Negative,40,October
2025-10-05 20:27:20,Scoring over 7000 points on the data camp courses,late submission on my Odyssey plan,Poor planning and time management,0.0,-0.3,-0.4,Neutral,Negative,Negative,40,October
2025-10-05 20:44:56,Learning about AI from data champ and the test kitchen,Not being able to attend every meeting,Other school obligations,0.0,0.5,-0.125,Neutral,Positive,Negative,40,October
2025-10-05 20:56:37,Pushed your project to GitHub and improved version control skills.,Struggled with a personal React Native project,Time management and switching between school and assignments,0.0,0.0,0.0,Neutral,Neutral,Neutral,40,October
2025-10-05 21:06:30,"Last week, I managed to complete the Introduction to Python course on DataCamp. I’m so proud of myself for earning this certificate. It was definitely a win for me!","One challenge I experienced was when I lost my Super Tutor badge after a student falsely marked me absent. It was disappointing because I had worked hard to maintain my performance and reputation on the platform. However, instead of giving up, I focused on delivering great lessons and maintaining professionalism with every student.

Over time, my effort paid off. I recently earned my Super Tutor badge back. That moment reminded me that perseverance and integrity always lead to success, even when setbacks happen.","A blocker I faced was struggling to manage my time between teaching and studying. Sometimes my lesson schedule would overlap with my study hours, making it difficult to stay consistent with my coursework. It slowed down my progress for a while, but I’ve been learning to plan better and set clearer boundaries between work and study time.",0.475,0.1775,0.0236111111111111,Positive,Neutral,Neutral,40,October
2025-10-05 23:05:42,I finished all my assessments on time,I couldn't attend some of my classes,i was sick,0.0,0.0,-0.7142857142857143,Neutral,Neutral,Negative,40,October
2025-10-05 23:20:14,I passed my semester test,,Last minute unplanned weather change,0.0,0.0,0.0,Neutral,Neutral,Neutral,40,October
2025-10-06 07:49:02,I landed a job interview,I did not pass an assessment for a role.,I do not have a reliable computer,0.0,0.0,0.0,Neutral,Neutral,Neutral,41,October
2025-10-06 09:20:06,Being able to work under pressure and finishing all my work activities in time.,I couldn't join other meetings because I was busy at work.,,0.5,-0.0124999999999999,0.0,Positive,Neutral,Neutral,41,October
2025-10-06 11:08:07,Discovering what I really want to do and what I really want to achieve in life.,I lost a bit of consistency,Exhaustion,0.2,0.0,0.0,Neutral,Neutral,Neutral,41,October
2025-10-06 11:15:23,I enjoyed working with my colleagues.,Time management especially since I am currently working and studying.,fatigue,0.5,0.0,0.0,Positive,Neutral,Neutral,41,October
2025-10-06 12:38:42,A win from the past week was designing my 10-year life plan. It was a deeply developmental and productive experience that helped me gain clarity about my long-term goals and the steps I need to take to achieve them,"A challenge I faced this week was struggling to speak up and share my thoughts. I often held back out of fear or hesitation, but I’m actively working on building my confidence to express myself more openly","A blocker I faced was ongoing network issues, which made it difficult to complete some of my online tasks and stay consistent with my work.",0.1833333333333333,0.0916666666666666,-0.05,Neutral,Neutral,Neutral,41,October
2025-10-06 14:00:59,my long run training went well.,managing my time between my freelance gig and attending online classes and marathon training.,laziness and procrastination.,-0.05,0.0,0.0,Neutral,Neutral,Neutral,41,October
2025-10-06 23:08:55,Discovering what I really want to do in life and also exploring which other options I have.,I slacked a bit and scored a 65/100 for an activity instead of a 70 and upwards.,exhaustion,0.0375,0.0,0.0,Neutral,Neutral,Neutral,41,October
2025-10-06 23:27:04,I got to finish most of my assingments.,I lost a lost of time during power outages.,I had/have occasional power outages in my area.,0.5,0.0,0.0,Positive,Neutral,Neutral,41,October
2025-10-07 00:01:23,,,,0.0,0.0,0.0,Neutral,Neutral,Neutral,41,October
2025-10-07 00:03:05,Passing most of my assignments,Failed one and did not manage to submit one on time.,Having too much work.,0.5,-0.5,0.2,Positive,Negative,Neutral,41,October
2025-10-07 02:37:29,nothing,everything,not enough hours in a day,0.0,0.0,0.0,Neutral,Neutral,Neutral,41,October
2025-10-07 15:38:57,,I attended the best concert of my life.,Fatigue stopped me from my regular gym schedule.,0.0,1.0,0.0,Neutral,Positive,Neutral,41,October
2025-10-07 15:42:18,I attended the best concert of my life (In the city) with someone special to me.,Juggling work load and this lead to me giving mediocre work which is not what I usually do.,Fatigue led to me being very tired and missing my regular gym schedule.,0.6785714285714286,-0.375,-0.24,Positive,Negative,Negative,41,October
2025-10-07 18:36:23,I made it to submit my tasks,i could not attend all my class,My time management,0.0,0.0,0.0,Neutral,Neutral,Neutral,41,October
2025-10-07 22:18:12,Was able to submit work and study for my exams,Couldn’t submit some work due to studying,Time… there are many classes and we also are studying,0.5,-0.125,0.5,Positive,Negative,Positive,41,October
2025-10-08 14:06:52,I got a voucher to write AZ900 and have been studying for it,"Time management, the more i take on the more creative i have to get with time management",,0.0,0.5,0.0,Neutral,Positive,Neutral,41,October
2025-10-08 18:03:59,All went well no complaint. I enjoyed 10 year odyssey plans assessment.,Nothing,Time Management and Multi tasking,0.325,0.0,0.0,Positive,Neutral,Neutral,41,October
2025-10-08 18:24:38,"Last week I improved at writing generative AI prompts. I experimented with style modifiers and repetition, which helped me create better, more accurate outputs. It was rewarding to see how small changes in wording improved results.",None this week.,"No major blockers at the moment, though I’d like more practice examples to sharpen my prompt engineering skills further.",0.275,0.0,0.15625,Neutral,Neutral,Neutral,41,October
2025-10-09 10:54:30,I was able to complete most of my of my google classroom tasks.,My coursera account was activated late which applies pressure on me due to submissions.,,0.3666666666666667,-0.2125,0.0,Positive,Negative,Neutral,41,October
2025-10-09 11:07:32,"Well something that I enjoyed last week was spending some quality time with my friends. We shared laughter, love and just good vibes and for me in all honesty that is a win. Memories are forever and I cherish all those I have created with my loved ones.",Something that was really challenging is time management. I think I got overwhelmed by a lot of tasks that  I took early on thinking I would managed and I later realized that I could not split the time accordingly.,"I think was biggest blocker was procrastination. ""Always leaving something for the next day"". It turns into an infinite loop until you decide to break the cycle.",0.5333333333333333,0.1999999999999999,0.0,Positive,Neutral,Neutral,41,October
2025-10-09 11:24:02,A win from last week for me was getting my platform app builder from Salesforce. This was a hard journey but I conquered the challenge and rose to the occasion.,A loss was being very behind with my umuzi work as I had little distractions that prevented me from being punctual with the work.,Time is a massive blocker. 24 hours never seems enough these days.,0.2770833333333333,-0.35375,0.0,Neutral,Negative,Neutral,41,October
2025-10-09 11:52:22,None on my side.,,,0.0,0.0,0.0,Neutral,Neutral,Neutral,41,October
2025-10-09 11:53:49,I managed to send my documents and complete my tasks.,"I am too busy, to the point that I miss some due dates.",School,0.1,-0.0124999999999999,0.0,Neutral,Neutral,Neutral,41,October
2025-10-09 12:37:28,,Our electricity going.,Have no electricity cannot do my work.,0.0,0.0,0.0,Neutral,Neutral,Neutral,41,October
2025-10-09 12:44:51,"Over the last week, I've had the opportunity to engage in a productive discussion with a group of individuals exploring sustainable development initiatives. The exchange of ideas and perspectives was enlightening, and it was rewarding to contribute to a meaningful conversation about strategies for promoting environmental stewardship and social responsibility.","One notable challenge I encountered was attempting to master a complex statistical analysis technique for a research project. Despite dedicating considerable time and effort, my initial results were inconclusive, and I struggled to interpret the data effectively. This experience highlighted the importance of perseverance and seeking guidance from experts in overcoming methodological hurdles.","A significant blocker I encountered was grappling with a complex problem that required specialized expertise. The challenge lay in accessing relevant resources and connecting with experts who could provide guidance. This experience underscored the importance of building professional networks and seeking mentorship to overcome knowledge gaps and stay focused on objectives.

In more detail, the blocker was related to navigating intricate information landscapes and identifying reliable sources to inform decision-making. The experience highlighted the value of developing effective information-seeking strategies and leveraging collaborative opportunities to drive progress.",0.2666666666666667,0.18,0.2392857142857143,Neutral,Neutral,Neutral,41,October
2025-10-09 21:22:22,My test went well,I couldn't write my test,I was sick,0.0,0.0,-0.7142857142857143,Neutral,Neutral,Negative,41,October
2025-10-10 04:47:56,Engagement and communication,Managing my calendar schedule but I improved,I would set a wrong time by mistake,0.0,0.0,-0.5,Neutral,Neutral,Negative,41,October
2025-10-10 04:51:32,Engagement and communication,Missed a class,I was not aware about usage of a calendar,0.0,0.0,-0.125,Neutral,Neutral,Negative,41,October
2025-10-10 07:42:01,Last week I managed to finish one of my key tasks ahead of schedule and received positive feedback from my lecturer/manager. It felt great to see my hard work paying off and boosted my confidence.,"I struggled a bit with managing my time — a few deadlines piled up, and I ended up feeling stressed trying to balance everything.","My internet connection was unstable for a couple of days, which made it difficult to attend online meetings and complete some work on time.",0.1471212121212121,-0.2,-0.2,Neutral,Negative,Negative,41,October
2025-10-10 09:52:27,Doing the Datacamp assessments was enjoyable. Loved the of the creating a children's book,"The submitting on time as it would change in s split second. When it says the submission is tomorrow, then you relax thinking you have time, then next thing it says the submission was yesterday and it wont let you submit, that was stressful as i never want to miss a submission.",As i mentioned above. the due dated shifting and missing submission because of it.,0.6,0.0,-0.1083333333333333,Positive,Neutral,Negative,41,October
2025-10-10 09:58:32,"A win from the past week was deepening my understanding of how AI systems think and create. I really enjoyed learning about AI acceleration, large language models, and generative AI, especially how tools like ChatGPT process massive amounts of data to produce human-like responses and how similar concepts apply to image generation. Exploring AI ethics also stood out because it reminded me that while AI is powerful, it must be used responsibly and transparently. Overall, I’m proud that I’m not just learning how to use AI tools, but how to think critically, creatively, and ethically about them.","A challenge I faced this week was fully understanding the technical depth behind large language models and AI acceleration. Concepts like how neural networks process data and how GPUs and TPUs enhance performance were sometimes difficult to grasp. I also found it challenging to balance my curiosity about AI’s capabilities with the need to think critically about its ethical use. Although it was tough at times, this experience reminded me that learning AI is a gradual process that requires patience, curiosity, and consistent effort.","A blocker I faced this week was the complexity of some AI concepts, particularly the technical details behind large language models and generative AI. At times, it slowed my progress because I had to spend extra time reviewing foundational concepts and examples to fully understand how these systems work. This made it harder to move quickly through practical exercises and experiments.",0.2510989010989011,-0.0138447971781305,0.0306122448979591,Neutral,Neutral,Neutral,41,October
2025-10-10 11:03:42,I was able to submit my tasks on time.,,,0.5,0.0,0.0,Positive,Neutral,Neutral,41,October
2025-10-10 11:14:24,"A win from the last week:
I’ve been learning more about Artificial Intelligence, ChatGPT, and Large Language Models (LLMs). It’s been exciting to explore how these technologies work and to discover new developments in the field. I enjoyed deepening my understanding and seeing how rapidly AI tools are evolving it motivated me to keep learning and experimenting with them.","A loss or challenge:
This past week was quite challenging because there were many activities due, and preparing for exams felt overwhelming at times. Balancing everything was difficult, but I’ve been managing to cope by staying organized and focusing on one task at a time.","I don’t have any major blockers at the moment everything is going according to plan, and I’m able to keep up with my tasks smoothly.",0.2313311688311688,0.1041666666666666,0.3208333333333333,Neutral,Neutral,Positive,41,October
2025-10-10 11:52:07,I was able to submit my fairytale 10 year oddesy story on time,I missed 2 deadlines,"Im full time student, this means I need to prioritise my school assignments and prepare for the upcoming test week before I do any extra-curricular activities",0.5,0.0,0.35,Positive,Neutral,Positive,41,October
2025-10-10 14:46:32,I managed to submit all my tasks in time,,,0.0,0.0,0.0,Neutral,Neutral,Neutral,41,October
2025-10-10 16:32:11,"I enjoyed learning about saving money, because I really wish to save but when I receive money it has many expenses. And learning that AI can do an app for me i just need to instruct it what to do",using AI to create an app it shows errors and timeout even when data and connections is working normally.,this week I managed to complete all task in time,0.3999999999999999,0.15,0.1,Positive,Neutral,Neutral,41,October
2025-10-10 18:36:58,I really enjoyed writing the children's odyssey book.,I had flu and felt weak.,I had no blocker this week,0.5,-0.375,0.0,Positive,Negative,Neutral,41,October
2025-10-10 18:44:23,completing assignments well and good gym sessions,not following up on personal goals,electricity cut out,0.7,0.0,0.0,Positive,Neutral,Neutral,41,October
2025-10-10 20:29:08,I have been just learning and growing my skills,I am losing my time management skills as I am not keeping up with submissions and it's not like me,I do not have,0.0,0.0,0.0,Neutral,Neutral,Neutral,41,October
