Timestamp,Win,Loss,Blocker,Win_sentiment,Loss_sentiment,Blocker_sentiment,Win_sentiment_category,Loss_sentiment_category,Blocker_sentiment_category,Week,Month
2025-08-20 19:05:02,"The exercises gave me a clear, actionable first steps to start building towards my ideal career path, which was incredibly motivating.",I felt anxious narrowing down my odyssey plans.,I had a low of power and got sick.,0.5375,-0.2027777777777777,-0.3571428571428571,Positive,Negative,Negative,34,August
2025-08-21 09:52:17,Empathizing,Time taken for the Odyssey plan,Network issues,0.0,0.0,0.0,Neutral,Neutral,Neutral,34,August
2025-08-21 10:40:25,"I managed to stay consistent with my assignments and finished one ahead of time, which gave me space to review my work properly. I also enjoyed collaborating with my peers during discussions.","I struggled a bit with time management, especially balancing different tasks, which made me feel slightly rushed at certain points.","No major blockers, but sometimes internet connectivity slows me down.",0.25,0.0119047619047619,-0.0934027777777777,Neutral,Neutral,Neutral,34,August
2025-08-21 10:49:23,,,,0.0,0.0,0.0,Neutral,Neutral,Neutral,34,August
2025-08-21 14:17:14,being to submit all the task and learn and reflect a lot about myself,Everyday submissions but i am adapting now,none,0.0,-0.2,0.0,Neutral,Negative,Neutral,34,August
2025-08-21 15:57:03,Getting a clear fundamentals behind AI,,,-0.15,0.0,0.0,Negative,Neutral,Neutral,34,August
2025-08-21 16:48:43,10 year plan,5 lives,,0.0,0.0,0.0,Neutral,Neutral,Neutral,34,August
2025-08-21 17:07:45,"I'm enjoying the Datacamp AI courses, very interesting","Did not realise how many assignments I had due today, so now I'm rushing through the material.",,0.575,0.1875,0.0,Positive,Neutral,Neutral,34,August
2025-08-21 18:03:09,I was consistent as I did all the required activities and met new wonderful people.,With the activities I wanted perfection and that made me submit on the last minute so I still struggle with time management.,I feel that home chores were a blocker but I will get used into managing my time.,0.4621212121212121,0.0,0.0,Positive,Neutral,Neutral,34,August
2025-08-21 18:15:32,Learning new things about Ai that i never thought of. It was greater diving deeper into it than just using it as my assistant,,Missed 2 session because my Wi-Fi was super down but I got it sorted and I am back,0.3181818181818182,0.0,0.0592592592592592,Positive,Neutral,Neutral,34,August
2025-08-21 19:36:59,I learnt a lot about myself through planning the Odyssey,I struugled to balance between Umuzi and Wits 'Preparing for my final year exams starting in September while also submitting projects.,Time,0.0,0.0,0.0,Neutral,Neutral,Neutral,34,August
2025-08-21 19:43:28,I enjoyed being with like minded peers,,,0.5,0.0,0.0,Positive,Neutral,Neutral,34,August
2025-08-21 19:46:42,The Design Your Life module helped me reflect on my life and boosted my motivation to achieve my dreams,"I didn’t find anything particularly challenging, though I was a bit disappointed that I had to miss Tuesday’s meeting due to a family responsibility.","I was pushing hard to meet the deadline for the DataCamp AI course and managed to complete 90%. However, I feel like my brain has absorbed a lot of information and is exhausted, so I’ll tackle the last Generative AI course tomorrow.",0.0,-0.125,-0.0583333333333333,Neutral,Negative,Neutral,34,August
2025-08-21 20:57:43,Being able to have direction in life by creating a plan and breaking it down each day,Not having completed my profile,Time management has been a stumbling block,0.1722222222222222,0.0,0.0,Neutral,Neutral,Neutral,34,August
2025-08-21 21:21:39,Odessey plan,none,Power outage,0.0,0.0,0.0,Neutral,Neutral,Neutral,34,August
2025-08-21 21:28:16,Engaging huddle sessions in our cohort,DataCamp access,DataCamp access,0.4,0.0,0.0,Positive,Neutral,Neutral,34,August
2025-08-21 21:39:17,Learned to empathize with others.,"Time extension for assignments, I feel like we are not given enough time sometimes. ",Not feeling well and being unable to attend classes.,0.0,0.0,-0.5,Neutral,Neutral,Negative,34,August
2025-08-21 22:00:12,I enjoyed the classes and that I managed to do all the tasks.,,,0.5,0.0,0.0,Positive,Neutral,Neutral,34,August
2025-08-21 22:25:52,I gain some valuable life skills and I enjoyed the sessions and the facilitators were very friendly,The challenge for me was that some sessions were clashing with my University practical's  but I still managed to attend all the sessions and pulled through,,0.49375,0.0,0.0,Positive,Neutral,Neutral,34,August
2025-08-21 22:35:43,I completed my first week successfully.,,"I’m balancing being a mom and a student at the same time. Attending Google meetings and completing assignments with a 5 month old is challenging, but I did it—I submitted everything on time, and I’m proud of myself.",0.5,0.0,0.35,Positive,Neutral,Positive,34,August
2025-08-21 23:13:44,"Got to reflect on myself and get to see what I really want in life or to achieve, a thing I didn't do often. The odyssey plan is still in my head and I'm starting to visualize myself achieving the things I have written.","Making a presentation for the odyssey plan, I was scared but got to overcome it and the laptop am using froze or stopped responding.",Just lack of courage and the laptop jamming.,0.1,0.0,0.0,Neutral,Neutral,Neutral,34,August
2025-08-22 00:21:29,I enjoyed the excercise about the 5 lives. It allowed me to be creative and explore different ideas.,"I found the 10 year plan to be challenging, only because at first I did not know what to write. I had to think hard about what i want and why I want it.","Fatigue, I was still adjusting to the new schedule.",0.3333333333333333,0.1145833333333333,0.1363636363636363,Positive,Neutral,Neutral,34,August
2025-08-22 09:29:46,I managed to submit all my work without the usual electricity blackout in my area,Missed a whole day because I just could not connect t the internet due to electricity blackout.,"I have an issue with my laptop, its windows is faulty so sometimes it does go blank but this doesn't happen often",-0.25,0.0375,0.0,Negative,Neutral,Neutral,34,August
2025-08-22 10:10:19,"I consistently returned to weightlifting, which I really enjoyed",I was unable to complete most of my work within the deadlines,"I did not have access to the internet, which prevented me from completing my tasks",0.375,0.0333333333333333,0.0,Positive,Neutral,Neutral,34,August
2025-08-22 12:00:07,I have enjoyed sharing knowledge with peers,,,0.5,0.0,0.0,Positive,Neutral,Neutral,34,August
2025-08-22 19:36:43,I learnt a lot and got to know how to use ChatGPT effectively,,,0.6,0.0,0.0,Positive,Neutral,Neutral,34,August
2025-08-22 20:41:47,"Just talking with the peers, learning that we are all trying to survive",I lost my aunt so everything kinda went blank,Loss of a loved one,0.0,0.0,0.7,Neutral,Neutral,Positive,34,August
2025-08-22 22:23:12,Getting to do the courses on DataCamp,Managing my time,,0.0,0.0,0.0,Neutral,Neutral,Neutral,34,August
2025-08-22 23:02:26,I enjoyed doing the wealthy me course because it made realize the importance of building wealth,Absolutely nothing happy week,Nothing,0.5,0.5,0.0,Positive,Positive,Neutral,34,August
2025-08-24 14:20:20,"A significant win was successfully handling a complex multi-part request that required me to integrate information from various domains. For instance, I recently answered questions about financial literacy, which involved a series of true/false and multiple-choice questions on topics like debt management, budgeting, and investing.","A challenging moment from the past week was trying to implement a new budgeting strategy that I learned about. I found it difficult to stick to the plan for my variable expenses, especially when I had unexpected social events pop up. It was a good reminder that while the theory is simple, applying it in real life requires a lot of discipline and flexibility.",A blocker for me has been dealing with some of my pre-existing debts. I've been so focused on learning about investing and budgeting that I haven't made as much progress on paying down my high-interest debt as I'd like. The interest charges feel like they're stopping me from moving forward with the other financial goals I'm learning about.,0.2321428571428571,0.0919696969696969,-0.0201388888888888,Neutral,Neutral,Neutral,34,August
2025-08-24 16:08:13,"I enjoyed the Odyssey plan, designing your life... Taught me so much on the things to always to consider while planning","Fell sick, had a very bad flu and that challenged my participation and submitting work on time",Sickness,0.35,-0.812142857142857,0.0,Positive,Negative,Neutral,34,August
2025-08-26 11:49:35,I got to hang out with some old friends from my home town.,I broke my spectacles.,Lack of leisure time.,0.1,0.0,0.0,Neutral,Neutral,Neutral,35,August
2025-08-26 16:37:49,Learned a lot about budgeting and investing for my future,Time management,,0.0,0.0,0.0,Neutral,Neutral,Neutral,35,August
2025-08-27 05:52:24,I was consistent in doing things that set me up for success,I got rejected for the Udacity Scholarship,,0.275,0.0,0.0,Neutral,Neutral,Neutral,35,August
2025-08-27 09:58:52,I managed to run 7km,I missed most of my meetings,,0.0,0.5,0.0,Neutral,Positive,Neutral,35,August
2025-08-27 11:09:04,making progress in DataCamp,Playing attention to detail at times,The laptop went in for repair,0.0,0.0,0.0,Neutral,Neutral,Neutral,35,August
2025-08-27 11:28:55,I completed all my tasks for the week and felt genuinely happy about the progress I made.,I struggled with time management mid-week and found myself rushing through some tasks instead of working at my best pace.,"No major blockers, but I did feel a bit overwhelmed balancing work and personal commitments, which made it harder to stay consistent.",0.8,1.0,0.0296875,Positive,Positive,Neutral,35,August
2025-08-27 11:35:10,I Enjoyed being introduced to using AI and how can we utilize them in our lives.,Internet connection sometimes.,,0.5,0.0,0.0,Positive,Neutral,Neutral,35,August
2025-08-27 12:18:52,"I have learned how to save money. Before, I would get overexcited when I received money and save about 50% of it, only to end up regretting it later. I have learned that I should save 15% of my income.",I can say nothing went wrong this week; all is well.,Nothing stopped me.,-0.1333333333333333,-0.5,0.0,Negative,Negative,Neutral,35,August
2025-08-27 12:35:57,"I am enjoying the course, I am learning a lot of new things about financial wellness. I enjoyed the lessons on Debt and Assets the most, very insightful.",,,0.306060606060606,0.0,0.0,Positive,Neutral,Neutral,35,August
2025-08-27 13:55:52,I enjoyed sharing my work with peers,I didn't have electricity for a whole week so i missed out on a lot of sessions and my workload piled up,Electricity and Family responsibilities,0.5,0.2,0.0,Positive,Neutral,Neutral,35,August
2025-08-27 13:55:57,I enjoyed exploring the powerful applications of AI and its ethical considerations surrounding them,"Everything went smooth, I completed all my assignments on time without any major challenges","Balancing sessions, lectures, and assessments was a challenge, but I managed to handle it well",0.3333333333333333,0.23125,0.0,Positive,Neutral,Neutral,35,August
2025-08-27 14:00:26,"Last week, I deepened my knowledge of AI and also learned about AI ethics which is something I hadn’t paid much attention to before. I also enjoyed the AI courses because DataCamp structures their lessons in a way that keeps you engaged...I also enjoyed building my app using replit","Everything went well, except I struggled a bit to get AI to cooperate with my image creation instructions.",there were no blockers,0.3,0.0,0.0,Positive,Neutral,Neutral,35,August
2025-08-27 14:12:18,My time management was good.,,"The power in my area keeps needing to be repaired, and this interrupts my workflow.",0.7,0.0,0.0,Positive,Neutral,Neutral,35,August
2025-08-27 14:43:32,"Leanerd about Financial classes for an investment vehicle, the portion to invest, weekely spending concept and snow balling concept for debt elimination. The course was great and very insightful.",Filling the sheets and the plans would have been great if it was interactive with other class members and more examples. One will get use to it and be more inspired to use these tools more often.,,0.3333333333333333,0.4349999999999999,0.0,Positive,Positive,Neutral,35,August
2025-08-27 14:49:43,Completing everything required and starting to keep ahead of deadlines,Something still challenging is time management,,0.0,0.5,0.0,Neutral,Positive,Neutral,35,August
2025-08-27 16:32:00,After doing the odyssey plan I did an odyssey plan budget which I get to experience how much funds I'm going to need for most of my pan to workout,,,0.35,0.0,0.0,Positive,Neutral,Neutral,35,August
2025-08-27 17:41:29,"I had a really tough week, nothing major... But I'm content and full of gratitude",Wanted to take content for the AWS Summit... but social anxiety and sickness got the best of me,"I got really sick last week, it was hard to cope with anything.... But this week is a different one and I'm UP!!!",0.0078703703703703,0.5166666666666667,-0.2514880952380952,Neutral,Positive,Negative,35,August
2025-08-27 19:10:11,I created a sushi crafter app with the assistance of AI.,It toke me longer than I had planned to complete my course work on datacamp.,"My graduation was on Saturday, I  had to juggle graduation prep and course work which resulted in not meeting the deadline i set.",0.0,0.1,0.0,Neutral,Neutral,Neutral,35,August
2025-08-27 19:19:43,Finished on time.,,,0.0,0.0,0.0,Neutral,Neutral,Neutral,35,August
2025-08-27 20:01:45,I just got my certificate  of completion today. I so happy i have manage to do it on time,"I still have last week work to complete and it give me stress, but I am trying to finish everything this week",The network on my side is very slow. Sometimes I can go a whole day with no connection,0.8,0.05,-0.095,Positive,Neutral,Neutral,35,August
2025-08-27 21:08:03,Completed tasks on time without interruption,,I had no electricity the whole day I had to travel to charge so that I write my quiz on the phone,0.0,0.0,0.2,Neutral,Neutral,Neutral,35,August
2025-08-27 22:32:58,"i am enjoying this worthy me course, it has completely changed my way of thing and the way i see money.",we currently have loadshedding in my area and thats affecting my work becouse i have to go and do my assignments out in public(mall) since i do not have any other relatives around,"loadshedding, both my phone and laptop were off, as a result i missed a session",0.311111111111111,-0.0625,0.0,Positive,Neutral,Neutral,35,August
2025-08-27 22:37:39,"I am enjoying the Wealth Me course, I keep learning new things. Even some that I knew but did not really realize how much they are affecting my financial health. I think by the end of this course I will definitely be and thinking like a wealthy me",,,0.1766233766233766,0.0,0.0,Neutral,Neutral,Neutral,35,August
2025-08-28 09:30:00,I was able to attend almost all sessions,I am struggling with completing and submitting tasks,not really knowing where to find my tasks,0.5,0.0,-0.1,Positive,Neutral,Neutral,35,August
2025-08-28 09:37:37,Learned a little bit more about finance and AI,,,0.15625,0.0,0.0,Neutral,Neutral,Neutral,35,August
2025-08-30 17:00:42,I managed to catch up on my activities,I couldn't manage my time better,Family responsibilities,0.0,0.5,0.0,Neutral,Positive,Neutral,35,August
2025-08-31 11:34:45,I did almost all my assigned tasks on time,I failed to do one task because I attended the lesson late and I didn't see the playlist,I waited long in the lobby for someone to let me in to the meeting,0.0,-0.4,-0.05,Neutral,Negative,Neutral,35,August
2025-09-01 14:52:12,wealty me course,could not finish in time due to some unforeseen circumstances,Exam anxiety,0.0,-0.125,0.0,Neutral,Negative,Neutral,36,September
2025-09-03 13:29:27,"It has been great seeing everyone's elevator pitch, got to learn a lot about everyone's goals.",,Been having microphone issues so haven't been able to fully participate this week.,0.8,0.0,0.5,Positive,Neutral,Positive,36,September
2025-09-03 16:03:47,Finally managed to fix my laptop,Had to sell my smartphone and downgrade,I have issues with internet but I am covered now for at least a month,0.0,0.0,-0.3,Neutral,Neutral,Negative,36,September
2025-09-03 18:35:13,I am Happy able to complete and get certificates on wealthy way,I missed some activities but i manage to complete some,network in my area is very bad.,0.475,0.1,-0.9099999999999998,Positive,Neutral,Negative,36,September
2025-09-04 20:34:22,I was able able to attend all classes and I learned a lot.,I could not complete the online courses,Cause I don't own a laptop or pc,0.5,-0.05,0.6,Positive,Neutral,Positive,36,September
2025-09-05 09:20:42,"I enjoyed working on polishing and strengthening my LinkedIn profile, I also enjoyed doing the elevator pitch video.",Everything went well,There were no blockers.,0.5,0.0,0.0,Positive,Neutral,Neutral,36,September
2025-09-05 13:40:13,"The CV writing session and content really stood out for me, it was very helpful. Through Hiration, I managed to improve my CV and the process was made easier by the AI feature in the platform.",,,0.2,0.0,0.0,Neutral,Neutral,Neutral,36,September
2025-09-05 16:01:29,Wrote 2 data science exams on DataCamp,Fell behind on some tasks,"Nothing, I just wish to bring more of my best to finish work on time",0.0,-0.4,0.75,Neutral,Negative,Positive,36,September
2025-09-08 10:52:58,Having completed my tasks and understanding the importance of finances,trying t6o figure out how to grow the little money I do have,"Having headaches stopped me from doing what i wanted too do
",0.0,-0.1875,0.0,Neutral,Negative,Neutral,37,September
2025-09-11 17:45:34,I had an interview,I didn't have a loss,"The blocker is that I hadn't received the data money or completing block 1 yet, so doing my work was chalenging",0.0,0.0,0.0,Neutral,Neutral,Neutral,37,September
2025-09-11 18:12:10,Everything is fine so far.,,,0.2583333333333333,0.0,0.0,Neutral,Neutral,Neutral,37,September
2025-09-11 19:46:33,"Finally finishing the project that we were given, although it was challenging but i managed to pull through.",I don't have a loss,No blocker,0.25,0.0,0.0,Neutral,Neutral,Neutral,37,September
2025-09-11 20:52:38,Nothing,I recieved rejection emails,,0.0,0.0,0.0,Neutral,Neutral,Neutral,37,September
2025-09-11 22:14:12,,,,0.0,0.0,0.0,Neutral,Neutral,Neutral,37,September
2025-09-12 00:41:32,Managed to finish a project I was working on.,Losta place to stay,Finances,0.0,0.0,0.0,Neutral,Neutral,Neutral,37,September
2025-09-12 09:03:51,Nothing this week,Nothing much this week,Nothing  thus far,0.0,0.2,0.1,Neutral,Neutral,Neutral,37,September
2025-09-12 09:20:57,I managed to complete the data cleaning and exploratory analysis of the Umuzi applicant dataset and even generated a full Jupyter Notebook. It felt rewarding to put my data science skills into practice and create something that can be reused.,"I struggled with merging and aligning some datasets, it slowed me down and reminded me how messy real-world data can be. It was frustrating not to get all the score-based insights I initially planned.","The blocker is the absence of aptitude test score columns in the extract. Without them, was difficult to test results and acceptance outcomes.",0.3166666666666666,-0.1888888888888889,-0.25625,Positive,Negative,Negative,37,September
2025-09-12 11:41:58,I have been working on the Customer Centricity course and find it quite interesting.,Everything has been going well for now.,Working from home was a bit more challenging this week. It was quite distracting and noisy .,0.5,0.0,0.5,Positive,Neutral,Positive,37,September
2025-09-12 17:26:20,I successfully started my new coursera course and completed the peer review.,Keeping track of all the Classroom activities.,I'd say poor time management.,0.4431818181818182,0.0,-0.4,Positive,Neutral,Negative,37,September
2025-09-14 09:09:54,I was able to complete some of my task without too much of help,my Daughter got sick,"I needed to stay with my Daughter at the hospital, which blocked me to finish my umuzi gigs on time",0.2666666666666666,-0.7142857142857143,0.0,Neutral,Negative,Neutral,37,September
2025-09-14 19:13:16,I have done Design thinking,Network blocked me from attending some meetings,"Network on my side is giving me problems, I end up not fully attending some meetings",0.0,0.0,0.0,Neutral,Neutral,Neutral,37,September
2025-09-15 23:15:46,Just submitting,Not doing well with my gig because i was sick,Sickness,0.0,-0.7142857142857143,0.0,Neutral,Negative,Neutral,38,September
2025-09-19 10:33:43,I was able to plan my budget for this month.,"However, it was challenging to apply some the knowledge since I do not have money.",Preparing for my stat tests,0.5,0.5,0.0,Positive,Positive,Neutral,38,September
2025-09-19 10:36:47,I was able to dive a bit into agents which I had not done before.,"However, I felt overwhelmed with too many tasks.",Balancing these tasks with my classes.,0.5,0.5,0.0,Positive,Positive,Neutral,38,September
2025-09-19 12:48:24,I enjoyed learning and seeing that fixing my finances isn't actually difficult. It takes a lot of discipline but it can be done.,,,0.0,0.0,0.0,Neutral,Neutral,Neutral,38,September
2025-09-29 16:07:39,,,,0.0,0.0,0.0,Neutral,Neutral,Neutral,40,September
2025-09-30 16:06:12,I enjoyed learning about my communication style,"Nothing was a loss
 Nothing was a loss",I could participate in Thursday meeting because of slow network,0.5,0.0,-0.3,Positive,Neutral,Negative,40,September
2025-09-30 16:52:18,I successfully managed to complete my assigned tasks.,,"Had some issues with internet data, but resolved now.",0.425,0.0,0.0,Positive,Neutral,Neutral,40,September
2025-09-30 18:39:07,"I was able to share my work in class, and it went well.",My internet was interrupted during one of my learning sessions due to heavy rain.,I underestimated the amount of work required for this week by not reading the material over the weekend.,0.5,-0.1625,0.0,Positive,Negative,Neutral,40,September
2025-10-01 05:26:19,I was able to get some work done,Really struggling with my schedule and umuzi classes,Time.. there’s a lot to do in a short space and at the same time I have to study for exams,0.5,0.2,0.0,Positive,Neutral,Neutral,40,October
2025-10-01 12:29:28,I felt confident with my understanding of the concepts we covered. I also enjoyed collaborating with peer.,"I struggled a bit with one of Coursera course, Developing An Entrepreneurial Mindset: First Step Towards Success,. It took longer than expected to complete it.","I sometimes find it challenging to balance time between assignments and engagement projects, which slightly slows my progress on complex exercises.",0.5,0.1375,0.0111111111111111,Positive,Neutral,Neutral,40,October
2025-10-01 15:25:49,I have submitted most of my assessments in time,some of work i did not submit the in time,procastinating,0.5,0.0,0.0,Positive,Neutral,Neutral,40,October
2025-10-01 16:15:43,"I don't remember having any work assigned from Umuzi last week, but the biggest highlight from last week was getting 73% on my Anthropology assignment. ","Actually, catching the Monday.com assignment late. I've experienced issues that have delayed me by two whole days, which is VERY uncharacteristic.","Terrible network issues both at home, as well as at my aunt's house. ",0.0,0.3,-1.0,Neutral,Positive,Negative,40,October
2025-10-02 16:35:29,Completed my project deliverables ahead of schedule,Struggled with time management and missed one internal check-in.,Coursera doesn't allow me to sign in,0.0,0.0,0.0,Neutral,Neutral,Neutral,40,October
2025-10-03 02:30:32,,,,0.0,0.0,0.0,Neutral,Neutral,Neutral,40,October
2025-10-03 15:55:28,I managed to complete all my onboarding documents and activities for the week in time,Had connectivity issues which affected my ability to engage with everyone in the class,delayed submitting before classes because of a test i am writing on the 4th,0.1,0.0,0.0,Neutral,Neutral,Neutral,40,October
2025-10-03 20:53:06,Gained access to Datacamp and have close to unlimited learning resources for Data,,Not having enough data to do more and more training on my skills,0.0,0.0,0.3333333333333333,Neutral,Neutral,Positive,40,October
2025-10-03 21:34:44,"I enjoyed having to draft the Odyssey plan, cause it forced us to think and regroup about what we want in life and what our dreams and goals are for us and people around us",So far nothing. I enjoyed learning about myself and my peers and exploring my future,,0.0999999999999999,0.1999999999999999,0.0,Neutral,Neutral,Neutral,40,October
2025-10-03 22:04:59,"I enjoyed activities about 10-year Odyssey Plan slide deck because  it The Odyssey Plan offers several benefits, including clarifying your values and goals, exploring possibilities, reducing pressure to make one ""right"" choice, increasing self-awareness, and creating a flexible plan that can be revisited and revised as you grow and change. By using this tool, you'll gain insight into what's truly important to you and can make more informed decisions about your life path.","Being able to fully be present during classes was a huge challenge for me because programs timetable clash with my Academic timetable (university), so trying to find balance and be able to manage activities and attendance was but challenging ",,0.2976190476190476,0.3166666666666667,0.0,Neutral,Positive,Neutral,40,October
